{
  "project": {
    "slug": "auto-lampard-fines",
    "title": "램파드 첼시 벌금표",
    "channel": "피치체크",
    "brand": "PITCHCHECK",
    "ratio": "4:5",
    "sourceLabel": "Chelsea FC / EPL archive",
    "ctaKeyword": "피치체크"
  },
  "style": {
    "template": "chuk9-editorial",
    "accent": "#25d9a3",
    "secondaryAccent": "#ffffff",
    "logoText": "CHUK9 CHECK"
  },
  "sources": [
    {
      "label": "Chelsea FC fine table story",
      "url": "https://www.chelseafc.com/",
      "note": "샘플 패키지는 기존 레포의 램파드/첼시 벌금표 카드뉴스 원고와 로컬 이미지를 사용한다."
    }
  ],
  "search": [
    {
      "query": "Frank Lampard Chelsea fines list training late phone ringing",
      "purpose": "벌금표 사실 검증 및 대체 이미지 후보",
      "preferredSources": ["official club archive", "credible sports media"]
    },
    {
      "query": "amateur futsal late attendance group chat Korea",
      "purpose": "조기축구/풋살 총무 공감 장면 후보",
      "preferredSources": ["user provided screenshot", "generated reconstruction"]
    }
  ],
  "media": [
    {
      "id": "cover",
      "path": "../../assets/images/topic-01/cover.jpg",
      "alt": "첼시 시절 프랭크 램파드",
      "credit": "Chelsea FC reference image",
      "usage": "cover hook"
    },
    {
      "id": "fine-table",
      "path": "../../assets/images/topic-01/detail_01.jpg",
      "alt": "첼시 벌금표를 설명하는 이미지",
      "credit": "Chelsea FC reference image",
      "usage": "story proof"
    },
    {
      "id": "discipline",
      "path": "../../assets/images/topic-01/detail_02.jpg",
      "alt": "램파드가 경기장에서 지시하는 장면",
      "credit": "Chelsea FC reference image",
      "usage": "discipline context"
    },
    {
      "id": "group-chat",
      "path": "../../assets/images/topic-01/detail_03.jpg",
      "alt": "지각 메시지 공감 장면",
      "credit": "Reference-only reconstruction",
      "usage": "amateur bridge"
    },
    {
      "id": "dashboard",
      "path": "../../assets/images/shared/pitchcheck_ui_dashboard.jpg",
      "alt": "피치체크 대시보드 UI",
      "credit": "PitchCheck app mockup",
      "usage": "product proof"
    },
    {
      "id": "gps",
      "path": "../../assets/images/shared/pitchcheck_ui_gps.jpg",
      "alt": "피치체크 GPS 출석체크 UI",
      "credit": "PitchCheck app mockup",
      "usage": "penultimate CTA"
    }
  ],
  "cards": [
    {
      "type": "cover",
      "role": "hook",
      "label": "축구인 공감 스토리",
      "headline": ["지각하면", "3,000만 원?!"],
      "body": "EPL 구단의 미친 벌금표",
      "media": "cover",
      "accent": ["3,000만 원"],
      "source": "Chelsea FC"
    },
    {
      "type": "stat",
      "role": "proof",
      "label": "실제 벌금표",
      "headline": ["미팅 지각 분당 75만 원", "전화 울리면 150만 원"],
      "body": "프로 팀은 시간 약속을 그냥 매너가 아니라 팀 규율로 관리합니다.",
      "media": "fine-table",
      "accent": ["75만 원", "150만 원"],
      "source": "Chelsea FC"
    },
    {
      "type": "story",
      "role": "meaning",
      "label": "팀 규율",
      "headline": ["시간 엄수는", "리스펙의 기본"],
      "body": "사소한 약속이 깨지는 순간, 전술보다 먼저 신뢰가 무너집니다.",
      "media": "discipline",
      "accent": ["리스펙"],
      "source": "PitchCheck edit"
    },
    {
      "type": "bridge",
      "role": "empathy",
      "label": "조기축구 현실",
      "headline": ["근데 우리 팀은", "매주 카톡방 전쟁"],
      "body": "거의 다 옴, 오늘 급한 일, 읽씹. 결국 속 타는 건 총무님입니다.",
      "media": "group-chat",
      "accent": ["카톡방 전쟁", "총무님"],
      "source": "PitchCheck edit"
    },
    {
      "type": "story",
      "role": "pain",
      "label": "총무 공감",
      "headline": ["벌금보다 힘든 건", "계속 독촉하는 일"],
      "body": "출석, 노쇼, 회비, 구장비까지 매번 말로 확인하면 팀 운영이 지칩니다.",
      "media": "dashboard",
      "accent": ["계속 독촉"],
      "source": "PitchCheck"
    },
    {
      "type": "pitchcheck",
      "role": "penultimate-cta",
      "label": "피치체크 기능",
      "headline": ["구장 반경 50m 안에서만", "진짜 출석 체크"],
      "body": "GPS 인증으로 지각생과의 쓸데없는 실랑이를 줄여줍니다.",
      "media": "gps",
      "accent": ["50m", "진짜 출석 체크"],
      "source": "PitchCheck"
    },
    {
      "type": "cta",
      "role": "final-cta",
      "label": "다운로드 CTA",
      "headline": ["댓글로 [피치체크]", "남겨주시면"],
      "body": "축구 팀 관리 앱 다운로드 링크를 보내드립니다.",
      "accent": ["[피치체크]", "다운로드 링크"],
      "ctaKeyword": "피치체크",
      "source": "PitchCheck"
    }
  ],
  "caption": "지각하면 벌금이 무려 3천만 원?!\n\n첼시 같은 프로 팀은 시간 약속을 그냥 매너가 아니라 팀 규율로 관리합니다.\n근데 우리 조기축구/풋살 팀은 매주 카톡방에서 참석 확인, 지각 독촉, 노쇼 확인까지 총무님 혼자 다 떠안는 경우가 많죠.\n\n이제 단톡방 감정 소모 줄이고,\nGPS 출석체크, 일정 투표, 회비 정산까지 피치체크로 관리해보세요.\n\n댓글로 [피치체크] 남겨주시면 다운로드 링크를 보내드립니다.\n\nContents Editor · PITCHCHECK\nSource · Chelsea FC / PitchCheck",
  "notes": "샘플은 자동화 구조 검증용이다. 실제 발행 전에는 벌금표 원출처, 이미지 사용권, 앱 다운로드 링크, DM 자동화 설정을 확인한다."
}
